{
  "$schema": "../../schemas/v1.7.1-human-qualification-plan.schema.json",
  "schemaVersion": 1,
  "planId": "goreecloud.glaze.v1.7.1.human-qualification",
  "name": "Glaze V1.7.1 Retained Human Qualification Review Plan",
  "lifecycle": "DevelopmentQualification",
  "successorReleaseLine": "1.7.1",
  "developmentIdentity": "1.7.1-dev.1",
  "sourceRevision": "4b9d085a5177b96cc31d4270b38d792a59872e37",
  "sourceModelVersion": "1.7.0-dev.47",
  "acceptanceModelVersion": "1.7.0-dev.39",
  "stableBaseline": "1.7.0",
  "historicalSourceStableBaseline": "1.6.0",
  "consumerEligible": false,
  "evidenceType": "human",
  "lanes": [
    "keyboard",
    "pointer",
    "representative-rendering",
    "human-visual-motion-review",
    "privacy-boundaries",
    "security-boundaries"
  ],
  "existingEvidencePrerequisites": {
    "keyboard": ["machine"],
    "pointer": ["machine"],
    "representative-rendering": ["rendered"],
    "human-visual-motion-review": [],
    "privacy-boundaries": ["machine"],
    "security-boundaries": ["machine"]
  },
  "requiredReviewScenarios": [
    "real-keyboard-focus",
    "real-pointer-activation",
    "expanded-representative-rendering",
    "compact-representative-rendering",
    "reduced-motion",
    "signature-motion-comprehension",
    "task-continuity",
    "privacy-authoritative",
    "privacy-untrusted-fail-closed",
    "security-authoritative-wardveil",
    "security-provider-spoof-fail-closed",
    "truth-conflict-fail-closed"
  ],
  "harness": "reference/v1.7/human-qualification.html",
  "preparation": "scripts/prepare_glaze_v1_7_1_human_qualification.py",
  "acceptanceRecord": "acceptance/v1.7-development.md",
  "execution": {
    "repositoryLocalOnly": true,
    "telemetryRequired": false,
    "remoteAnalysisRequired": false,
    "realHumanObservationRequired": true,
    "realKeyboardInteractionRequiredForKeyboardLane": true,
    "realPointerInteractionRequiredForPointerLane": true,
    "reviewerMustConfirmRepresentativeRuntimeForRenderingLane": true,
    "reviewerMustObserveMotionAndReducedMotion": true,
    "reviewerMustInspectPrivacyAndSecurityTruthBoundaries": true,
    "reviewFindingsMustBeRecordedOutsideHarness": true,
    "generatedEvidenceAutomatic": false
  },
  "evidenceBoundary": {
    "reviewSurfaceOnly": true,
    "humanEvidenceClaimedByPlan": false,
    "assistiveTechnologyEvidenceClaimed": false,
    "physicalDeviceEvidenceClaimed": false,
    "performanceEvidenceClaimed": false,
    "energyEvidenceClaimed": false,
    "section48Accepted": false,
    "v171AcceptanceClaimed": false,
    "lifecyclePromotionAutomatic": false,
    "consumerAcceptanceAutomatic": false,
    "deploymentAcceptanceAutomatic": false,
    "productionAcceptanceAutomatic": false
  },
  "boundary": "This plan prepares an exact-source, repository-local human review surface for six V1.7.1 retained lanes whose missing evidence can be satisfied by human observation when the other required evidence groups are already present or not required. The harness is not a reviewer, has no PASS control, creates no canonical evidence, cannot manufacture privacy or security truth, and cannot satisfy Assistive Technology, physical-device, performance, energy, Section 48, lifecycle, consumer, deployment, or production acceptance. Accepted human evidence must come from an actual review of the frozen source, be independently recorded with the environment, observations, limitations, and evidence reference, and be evaluated through the governed acceptance process."
}
